nameType,examples
egyptianDeities,aker amenhotep amheh ammit amun amunet anat anhur anput anti anubis anuket apedemak apep apis arensnuphis ash astarte aten atum baal baalatgebal babi banebdjedet bapef bast bat bennu bes buchis dedun geb ha hapi hathor hatmehit hedetet heh heka heket heryshaf hesat horus hu iah iat ihy imentet imhotep ishtar isis iusaaset khepri kherty khnum khonsu maahes maat mafdet mandulis mehen mehetweret mehit menhit meretseger meskhenet min mnevis montu mut nebethetepet nefertum nehebukau nehmetawy neith nekhbet neper nephthys nu nut osiris pakhet ptah qetesh ra raettawy renenutet renpet reshep satet seker sekhmet serapis serket seshat set shai shed shesmetet shezmu shu sia sobek sopdet sopdu tabitjet tatenen taweret tefnut tenenet thoth tutu unut wadjet wadjwer weneg wepwawet werethekau wosret yam
emotions,adoration affection aggravation agitation agony alarm alienation amazement amusement anger anguish annoyance anxiety anxiety apprehension astonishment attractiveness awe bitter bliss boredom calmness caring compassion contempt contempt contentment courage crosspatch defeatism dejection delight depression desire despair disappointment disgust dislike dismay displeasure distress doubt dread eagerness ecstasy elation embarrassment empathy enthrallment envy envy euphoria exasperation excitement exhilaration fear ferocity fondness friendliness fright frustration fury gaiety gladness glee gloom glumness grief grouchy grumpy guilt happiness hatred helplessness homesickness hope horror hostility humiliation humility hurt hysteria infatuation insecurity  insult interest irritability irritation isolation jealousy jolliness joviality joy jubilation liking loathing loneliness longing love lust melancholy misery mortification neglect nervousness optimism outrage panic passion pity pleasure politeness powerlessness pride rage rapture reactive regret rejection relaxation relief relief remorse resentment revulsion sadness sadness sadness satisfaction scorn sentimentality serenity shame shock sorrow spite stress suffering surprise suspense sympathy tenderness tension terror thrill torment triumph trust uneasiness unhappy vengefulness woe worry wrath zeal zest
englishTowns,abingdon accrington acle acton adlington alcester aldeburgh aldershot alford alfreton alnwick alsager alston alton altrincham amble ambleside amersham amesbury ampthill andover appleby arlesey arundel ashbourne ashburton ashby ashford ashington ashton askern aspatria atherstone attleborough axbridge axminster aylesbury aylsham bacup bakewell bampton banbury barking barnard barnes barnet barnoldswick barnsley barnstaple barrow barton basildon basingstoke batley battle bawtry beaconsfield beaminster bebington beccles beckenham bedale bedford bedworth belper bentham berkeley berkhamsted berwick beverley bewdley bexhill bexley bicester biddulph bideford biggleswade billericay billingham bilston bingham bingley birchwood birkenhead bishop blackburn blackpool blackrod blackwater blandford bletchley blyth bodmin bognor bollington bolsover bolton bootle bordon boroughbridge boston bottesford bourne bournemouth bovey brackley bracknell bradford brading bradley bradninch braintree brampton brandon braunstone brentford brentwood bridgnorth bridgwater bridlington bridport brierfield brierley brigg brighouse brightlingsea brixham broadstairs bromborough bromley bromsgrove bromyard broseley brough broughton bruton buckfastleigh buckingham bude budleigh bulwell bungay buntingford burford burgess burgh burnham burnley burntwood burslem burton burton bury bury bushey buxton caistor callington calne camborne camelford cannock canvey carlton carnforth carshalton carterton castle castleford chagford chapel chard charlbury chatham chatteris cheadle cheltenham chertsey chesham cheshunt chester chesterfield chickerell chilton chingford chippenham chipping chipping chipping chorley chorleywood christchurch chudleigh chulmleigh church cinderford cirencester clare clay cleator cleethorpes cleobury clevedon clitheroe clun cockermouth coggeshall colburn colchester coleford coleshill colne colyton congleton conisbrough corbridge corby corringham corsham cotgrave coulsdon cowes cramlington cranbrook craven crawley crediton crewe crewkerne cricklade cromer crook crosby crowborough crowland crowle croydon cullompton dagenham dalton darley darlington dartford dartmouth darwen daventry dawley dawlish deal denholme dereham desborough devizes dewsbury didcot dinnington diss doncaster dorchester dorking dover dovercourt downham driffield droitwich dronfield dudley dukinfield dulverton dunstable dunwich dursley ealing earby earl earley easingwold east east east east eastbourne eastleigh eastwood eccles eccleshall edenbridge edgware edmonton egremont elland ellesmere ellesmere elstree emsworth enfield epping epworth erith eton evesham exmouth eye fairford fakenham falmouth fareham faringdon farnham faversham fazeley featherstone felixstowe ferndown ferryhill filey filton finchley fleet fleetwood flitwick folkestone fordbridge fordingbridge fordwich fowey framlingham frinton frodsham frome gainsborough garstang gateshead gillingham gillingham glastonbury glossop godalming godmanchester goole gorleston gosport grange grantham grassington gravesend grays great great great greater grimsby guildford guisborough hadleigh hailsham halesowen halesworth halewood halifax halstead haltwhistle harlow harpenden harrogate harrow hartland hartlepool harwich harworth haslemere haslingden hastings hatfield hatfield hatherleigh havant haverhill hawes hawkinge haxby hayle haywards heanor heathfield hebden hedge hednesford hedon helmsley helston hemel hemsworth hendon henley hertford hessle hetton hexham heywood high higham highbridge highworth hinckley hingham hitchin hoddesdon holbeach holsworthy holt honiton horley horncastle hornsea hornsey horsforth horsham horwich houghton hounslow howden huddersfield hungerford hunstanton huntingdon hyde hythe ilford ilfracombe ilkeston ilkley ilminster immingham ingleby ipswich irthlingborough ivybridge jarrow keighley kempston kendal kenilworth kesgrave keswick kettering keynsham kidderminster kidsgrove kimberley kingsbridge kingsteignton kingston kington kirkby kirkbymoorside kirkham kirton knaresborough knutsford langport launceston leatherhead lechlade ledbury leek leigh leighton leiston leominster letchworth lewes leyburn leyton liskeard littlehampton loddon loftus long longridge longtown looe lostwithiel loughborough loughton louth lowestoft ludgershall ludlow luton lutterworth lydd lydney lyme lymington lynton lytchett lytham mablethorpe macclesfield madeley maghull maidenhead maidstone maldon malmesbury maltby malton malvern manningtree mansfield marazion march margate marlborough marlow maryport masham matlock medlar melksham meltham melton mere mexborough middleham middlesbrough middleton middlewich midhurst midsomer mildenhall millom milton minchinhampton minehead minster mirfield mitcham mitcheldean modbury morecambe moreton moretonhampstead morley morpeth mossley much nailsea nailsworth nantwich needham nelson neston newark newbiggin newbury newcastle newent newhaven newlyn newmarket newport newquay newton normanton north northallerton northam northampton northfleet northleach northwich norton nuneaton oakengates oakham okehampton oldbury oldham ollerton olney ongar orford ormskirk ossett oswestry otley ottery oundle paddock padiham padstow paignton painswick partington patchway pateley peacehaven penistone penkridge penrith penryn penwortham penzance pershore peterlee petersfield petworth pickering plympton pocklington polegate pontefract ponteland poole porthleven portishead portland potton poynton preesall prescot princes prudhoe pudsey queenborough radstock ramsey ramsgate raunds rawtenstall rayleigh reading redcar redditch redenhall redruth reepham reigate richmond richmond ringwood ripley rochdale rochester rochford romford romsey ross rothbury rotherham rothwell rowley royal royston rugby rugeley rushden ryde rye saffron salcombe sale saltash sandbach sandhurst sandiacre sandown sandwich sandy sawbridgeworth saxmundham scarborough scunthorpe seaford seaham seaton sedbergh sedgefield selby selsey settle sevenoaks shaftesbury shanklin shefford shepshed shepton sherborne sheringham shifnal shildon shipston shirebrook shoreham shrewsbury sidmouth silloth silsden sittingbourne skegness skelmersdale skelton skipton sleaford slough smethwick snaith snodland soham solihull somerton southall southam southborough southend southgate southminster southport southsea southwell southwick southwold spalding spennymoor spilsby sprowston stafford staines stainforth stalbridge stalham stalybridge stamford stanhope stanley stapleford staveley stevenage steyning stockport stocksbridge stockton stone stonehouse stony stotfold stourbridge stourport stow stowmarket stratford stretford strood stroud sturminster sudbury surbiton sutton sutton swaffham swanage swanley swanscombe swindon syston tadcaster tadley tamworth taunton tavistock teignmouth telford telscombe tenbury tenterden tetbury tewkesbury thame thatcham thaxted thetford thirsk thornaby thornbury thorne thorpe thrapston tickhill tidworth tipton tisbury tiverton todmorden tonbridge topsham torpoint torquay totnes tottenham totton tow towcester town tring trowbridge twickenham tynemouth uckfield ulverston uppingham upton uttoxeter uxbridge ventnor verwood wadebridge wadhurst wainfleet wallasey wallingford wallsend walsall waltham waltham walthamstow walton wantage ware wareham warminster warrington warwick washington watchet watford wath watlington watton wednesbury wellingborough wellington wells welwyn wembley wendover westbury westerham westhoughton weston wetherby weybridge weymouth whaley whitby whitchurch whitehaven whitehill whitnash whittlesey whitworth wickham wickwar widnes wigan wigton willenhall willesden wilmslow wilton wimbledon wimborne wincanton winchcombe winchelsea windermere windsor winsford winslow winterton wirksworth wisbech witham withernsea witney wiveliscombe wivenhoe woburn woburn woking wokingham wolsingham wolverton wood woodbridge woodley woodstock wooler workington worksop worthing wotton wragby wymondham yarm yarmouth yate yateley yeovil
ethnicGroupsContemporary,albanians arabs armenians assyrians azerbaijanis balochis bamars basques bengalis berbers biharis bosniaks bulgarians catalans chuvash circassians congolese croats czechs danes dutch english estonians faroese finns french gagauz galician georgians germans gorans greeks gujaratis han hui hungarians icelanders india irish italians japanese javanese jews kannada kazakhs koreans kurds kyrgyz laz lebanese macedonians malayali malays manchu marathi mongols norwegians oromo pashtuns persians poles portuguese punjabis romani romanians russians scotland scottish serbs sindhis sinhalese slovaks slovenes sorans spaniards sundanese swedes tamils tatars telugu thais tibetan tuaregs turkmens turks ukrainians uyghur vietnamese welsh zazas zhuang
fabrics,aba acrilanfabric acrylic aertex airdura airguard alençonlace angora antiquesatin argentanlace argentellalace armenianneedlelace baize ballisticnylon bamboo barathea barkcloth batik batiste battenberglace bedfordcord benaras bengalinesilk betacloth bobbinet boiledwool bombazine bouclé braid brilliantine broadcloth brocade buckram bunting buranolace burattolace burlap calico cambric camelhair camlet canvas capilene carbonfiber carrickmacrosslace casement cashmere cavalrytwill cedarbark challis chambray chantillylace charcloth charmeuse charvet cheesecloth chenille chiengora chiffon chino chintz cloqué coir conductive coolmax cordura corduroy cotton cottonduck coutel cretonne crimplene crinoline crochet crêpebacksatin damask darlexx dazzle delainewool denim dimity dobby doeskin donegaltweed doublecloth doubleknitting doubleweave dowlas drill drugget duck dungarees dupionisilk dyneema egyptiancotton eyelet faille fauxfur felt fishnet flannel flannelette fleece foulard fustian gabardine gannex gauze gazar georgette ghalamkar gingham goretex grenadine grenfellcloth grosgrain habutai haircloth halaslace harristweed heatherknit hemp herringbone himroo hodden hollandcloth hopsack houndstoothcheck indiancotton intarsia interlock irishlinen jaconet jacquard jacquardknit jamdani jersey jute kemp kenmarelace kentecloth kerseymere kevlar khaki khakidrill kincob knit lace lambswool lampas lamé lanon lantana lawncloth lazzer leather leatherette leno limericklace linen linseywoolsey loden longcloth loopknit lumalive lycraknit madapolam madras malimo marquisette matelassé melton merino mesh microfibre milliskin mockado mohair moire moleskin monkscloth moquette mouflon mousseline muslin naturalfiber neoprene nomex nylon oilskin omran organdy organza osnaburg ottoman oxford paduasoy paisley pannévelvet percale piqué plissé plush pointelle polarfleece polyester pongee poplin qiviut quilting rakematiz raschelknit rawsilk rayadillo rayon rep reticellalace ribbonlace ribknit ribweave rinzu ripstop ripstopnylon russellcord sailcloth samite sateen satin saye scarlet scrim seersucker sequin serge shantung sharkskin shotsilk silk silknoil silnylon smartwool songket spandex stockinette stubtex stuff suede surah sympatex taffeta tambourlace tammana tapestry tartan teneriffelace terrycloth terryvelour ticking toile tricotknit tullenetting tussarsilk tweed twill ultrasuede velour velvet velveteen venetianlace venetianwool ventile vintage viyella voile wadmal whipcord wigan windstopper wool worcester worsted wool yarn youghallace zephyr zibeline zorbeez terrycotton terrysilk terrywool
fellsInCambria,allencrags angletarnpikes ardcrags armbothfell arnisoncrag arthurspike bakestall bannerdalecrags barrow basebrown bedafell binsey birkerfell birkhousemoor birks blackcombe blackfell blakefell bleaberryfell blearigg blencathra bonscalepike bowfell bowscalefell braefell brandreth branstree brimfell brockcrags broomfell brownpike buckbarrow buckpike burnbankfell calfcrag carlside carrockfell castlecrag catbells catstycam caudalemoor causeypike cawfell cloughhead coldpike conistonoldman cragfell craghill crinklecrags dalehead dent dollywaggonpike dovecrag dowcrag eaglecrag eskpike fairfield fellbarrow firbankfell fleetwithpike froswick gavelfell gibsonknott glaramara gowbarrowfell grangefell grasmoor graycrag grayrigg graystones greatborne greatcalva greatcarrs greatcrag greatdodd greatend greatgable greatmellfell greatrigg greatscafell greencrag greengable greycrag greyfriar greyknotts grike grisedalepike hallinfell hardknott hartcrag harterfell harterfell hartside hartsopdodd hartsophow haycock haystacks helmcrag helvellyn hencomb heronpike highcrag highpike highpike highraise highrigg highseat highspy highstile highstreet hightove hindscarth holmefell hopegillhead illbell illgill kentmerepike kidstypike kirkfell knott knottrigg lankrigg latrigg lingfell lingmell lingmoorfell littlehartcrag littlemellfell loadpothill loftcrag longlandsfell longside lonscalefell lordseat loughriggfell lowfell lowpike lowthwaitefell maidenmoor mealfell mellbreak middledodd middlefell muncasterfell mungrisdale nabscar nethermostpike outerside paveyark pillar placefell raise rampsgillhead rannerdaleknotts ravencrag redpike redscrees restdodd robinson rossettpike rosthwaitefell sail saintsundaycrag salefell sallows scafell scafellpike scarcrags scoatfell seatallan seathwaitefell seatsandal selsidepike sergeantman sergeantscrag sheffieldpike shipmanknotts silverhow skiddaw slatefell slightside sourhowes southerfell starlingdodd steelfell steelknotts steeple stonearthur stybarrow swirlhow tarncrag  thornthwaitecrag thunacarknott troutbecktongue ullockpike ullscarf wainwrights wallacrag wandope wansfell watchhill wetherhill wetherlam whinlatter whinrigg whitelesspike whiteside whiteside whitfell yewbarrow yoke
fish,albacore albacore alewife alfonsino algaeeater alligator alligatorfish amberjack anchovy anchovy anemonefish angelfish angler anglerfish arapaima archerfish armorhead arowana arrowtooth aruana ayu baikal bala ballan bandfish bangus banjo barb barbel barfish barracuda barracuda barracudina barramundi barreleye baskingshark bass basslet basslet batfish batfish batray beachsalmon beardfish betta bichir bigeye bigscale billfish bitterling blackchin blackfish blackfish bleak blenny blenny blobfish blowfish blueeye bluefin bluefish bluegill boafish boarfish bocaccio boga bonefish bonito bonnetmouth bonytongue bowfin boxfish bream bream brill bristlemouth bristlenose brooder brotula brotula buffalo buffalofish bullhead bullheadshark bullshark bulltrout burbot buri burmadanio burrfish butterflyfish butterflyray candiru candlefish capelin cardinalfish cardinalfish cardinaltetra carp carp carp carpetshark carpetshark carpsucker catalufa catalufa catfish catfish catla catshark cavefish channelbass channelcatfish char char cherrysalmon cherubfish chimaera chimaera chinooksalmon chub chub chubsucker chumsalmon cichlid cichlid cisco clingfish clingfish clownfish cobbler cobia cod cod codlet codlet codling coelacanth coffinfish cohosalmon coley combfish conger cookiecutter coolieloach cornetfish corydoras cowfish cownose cowshark crappie crestfish croaker crocodileshark cuckoowrasse cusk cuskeel cutlassfish cutthroateel cutthroattrout dab dace dace daggertooth daggertooth damselfish danio danio danio darter darter darter dartfish dealfish demoiselle devario devilray dhufish discus diver dogfish dogfish dogteeth dolphinfish dorab dorado dory dory dottyback dragonet dragonfish dragonfish dragongoby driftfish drum duckbill duskygrouper eagleray eel eelgoby eelpout eeltailcatfish elasmobranch electriceel elephantnose elephantnose elver emperor escolar escolar eulachon fangtooth featherback fierasfer filefish fingerfish firefish flagblenny flagfin flagfish flagtail flashlightfish flatfish flathead flathead flier flounder flounder flyingfish flyingfish footballfish fringehead frogfish fusilier galjoen gangesshark gar garibaldi garpike ghostfish ghostflathead ghostknifefish ghostpipefish ghostshark ghoul gibberfish glassfish glassfish goatfish goatfish goby goby goldentrout goldeye goldfish gombessa goosefish gourami gourami gourami graveldiver grayling grayling greeneye greenling grenadier groundshark grouper grunion grunt grunter gruntsculpin gudgeon guitarfish gulper gulper gunnel gunnel guppy gurnard gurnard gurnard haddock hagfish hairtail hake hake halfbeak halfmoon halibut halibut halosaur hamlet hammerhead hammerjaw handfish hardhead harelip hatchetfish hatchetfish hawkfish herring herring hogsucker hoki hornshark horsefish horsemackerel houndshark houndshark huchen hussar icefish icefish ide ilisha inanga inconnu jack jackfish javelin jawfish jellynose jewel jewelfish jewfish johndory kafue kahawai kaluga kanyu kelpfish kelpfish kelpperch killifish killifish kingfish kingofthesalmon knifefish knifefish knifejaw koi kokanee kokopu labyrinthfish ladyfish lagena lampfish lampfish lamprey lamprey lancetfish lanternfish lanternshark largemouth leaffish leatherjacket lefteyeflounder lemonshark lemonsole lenok leopard lightfish limia linedsole ling lingcod lionfish lionfish livebearer lizardfish loach longfin loosejaw louvar luderick lumpsucker lungfish lungfish mackerel mackerel mackerelshark madtom mahseer makoshark manefish manofwar mantaray marblefish marlin masu medaka medusafish megamouthshark menhaden menhaden milkfish minnow minnow minnowofthedeep modocsucker mojarra mola mola monkfish mooneye moonfish mora moray moray morid morwong mosquitofish mouthbrooder mrigal mudcat mudfish mudminnow mudminnow mudminnow mudskipper mudsucker mudsucker mullet mullet mummichog murraycod muskellunge mustardeel nase needlefish nibblefish noodlefish noodlefish nurseryfish nurseshark oarfish oilfish oilfish oldwife opah opaleye oscar paddlefish panga paradisefish parore parrotfish parrotfish peacockflounder peamouth pearleye pearlfish pelicaneel pencilfish pencilsmelt perch pickerel pickerel pigfish pike pikeblenny pikeconger pikeperch pilchard pilotfish pineapplefish pineconefish pinksalmon pipefish piranha pirarucu pirateperch plaice platy platyfish pleco plownose poacher pollock pollock pollyfish pomfret pomfret pompano ponyfish porbeagle porcupinefish porgy powen prickleback prickleback pricklefish pricklyshark prowfish prowfish puffer puffer pufferfish pumpkinseed pupfish pupfish píntano quillback quillfish rabbitfish ragfish rainbowfish rainbowfish rainbowtrout rasbora ratfish rattail ray razorfish redfin redfish redlip redmouth redsalmon redsnapper reedfish reefshark reefshark remora requiemshark ribboneel ribbonfish riceeel ricefish ridgehead rivuline rivuline roach roanokebass rockbass rockbeauty rockcod rockfish rockfish rockfish rockling rohu ronquil roosterfish ropefish roughscad roughsculpin roughy roughy roundhead rudd rudderfish ruffe sabertooth sabertoothfish sablefish sailfish salamanderfish salmon salmon salmonshark sandbarshark sandburrower sanddab sanddiver sandeel sandfish sandgoby sandknifefish sandlance sandperch sandroller sandstargazer sandtiger sandtilefish sardine sargassumfish sauger saury saury sawfish sawshark scabbardfish scabbardfish scalyfin scat scissortail scorpionfish sculpin sculpin sculpin scup seabass seabream seacatfish seachub seadevil seadragon seahorse sealamprey seamoth searaven searobin searobin searobin seasnail seatoad shad shad shark sharksucker sharpnose sheatfish sheepshead sheepshead shiner shiner shrimpfish siamesefightingfish sillago silverside silverside sixgillray sixgillshark skate skilfish skipjacktuna sleeper sleepershark slickhead slimehead slipmouth smelt smelt smeltwhiting snailfish snakeeel snakehead snapper snapper snipeeel snipeeel snipeeel snipefish snoek snook snubnose soldierfish sole spadefish spaghettieel spearfish speckledtrout spiderfish spikefish spinefoot spinyfin splitfin spookfish sprat springfish squaretail squaretail squaretail squawfish squawfish squawfish squeaker squirrelfish stargazer stargazer steelhead stickleback stickleback stingfish stingray stingray stonecat stonefish stoneroller sturgeon sturgeon sturgeon sucker sunfish sunfish sunfish surfperch surgeonfish swallower swallower swampeel swampfish sweeper swordfish swordtail swordtail sábalo tadpolefish tailor taimen tang tang tapetail tarpon tarwhine telescopefish tench tenpounder tenuis tetra tetra thornfish threadfin threadtail thresher tigerbarb tigerperch tigershark tilapia tilefish toadfish tommyruff tompot tonguefish tope topminnow torpedo trahira treefish trevally trevally triggerfish triggerfish triplefin triplespine tripletail trout troutperch trumpeter trumpetfish trunkfish tubeblenny tubeeye tubeshoulder tubesnout tuna tunny turbot turkeyfish uaru unicornfish unicornfish vanjaram velvetfish velvetfish vendace vimba viperfish viperfish wahoo wallago walleye walu warmouth wartyangler waryfish waspfish weaselshark weatherfish weaver weever weeverfish whalefish whalefish whalefish whaleshark whiff whitebait whitecroaker whitefish whitefish whitemarlin whiteshark whiteshark whitetip whitetipshark whiting whiting wobbegong wolfeel wolffish wolfherring wormeel wormfish wrasse wrasse wrymouth yellowbass yellowhead yellowjack yellowmargin yellowtail zander zebrafish zebraloach zebrashark ziege zingel
flowersCommonNames,acacia acorn allium allspice aloe alyssum amaryllis ambrosia anemone angelica aniseed apple arbutis artemisia aster astilbe azalea balloonflower basil bayleaf beebalm begonia bellflower blanketflower bleedingheart bluebell borage broom burnet buttercup butterflybush butterflyweed cactus calendula camellia candytuft carnation catmint cattail chamomile chrysanthemum clematis clover columbine coneflower coralbells coreopsis coreopsis coriander cosmos cowslip crocus cyclamen daffodil dahlia daisy dandelion daylily delphinium eucalyptus fennel fern forgetmenot forsythia foxglove gardenia garlic gayfeather geranium gladiolus globeflower grass geranium heather hibiscus holly hollyhock honeysuckle hosta hyacinth hydrangea hyssop impatien iris ivy jasmine jonquil juniper kerria lamium lantana larkspur lavender lemon lilac lily lilyofthevalley lobelia loosestrife lupine magnolia marigold marjoram mint mistletoe monkshood moonflower morningglory moss myrtle narcissus nasturtium nicotiana oleander orangetree orchid palm pansy passionflower peach peony petunia petunias pine pinks poppy pricklypear primrose rhododendron rose rosemary sage salvia scabiosa scilla sedum shrubroses silverlacevine smilax snapdragon snowballbush snowdrops spiderflower stephanotis stock strawberry sunflower sweetpea thyme trumpetvine tulip vinca violet viscaria wisteria woodruff yarrow zinnia
