nameType,examples
indianForenames,abhay abhinav abhishek adarsh adesh adi aishwarya ajay ajish ajit akhil akhila ambica ami amit amita ammar amrita ananya anil anirban aniruddha anjali ankit ankita anu anuj anup anupam anupama anurag anushree apoorva arindam arjun arpita arti arun arunachalam arundhati arvind arya aryaman aseem ashoka ashvin ashwin bali ballabh bharat bhardwaj bhavesh bhupinder bhushan bibin biju binod binu bipasha chandrajit damayanti deepa deepak deepali deepika deepti devanshi devendra devesh dhanishka dinesh dipankar ekram eva ganesh gayatri girish girjesh gita gitanjali gopinathan gurcharan gurunath hansraj hara hardik harish harjit harsh harshita hemalata hitesh indira indrani indranil indumati ira ishana jacqueline jagannath jaipal jalaj jara jayant jayashankar jesminder jitendra juhi kailash kalimuthu kamala kanika karthik karthika karthikeyan kaushal kavita kazi kirtan kishor kripesh krishnan krishnappa krishnayya kumar kumudini lakshan lakshanya lakshman lata latha lauretta leela leelavathi leila lena madhuri mahboob mahendra mallika mandar manish manjula manmohan manorama maya mayank mira mukesh munish muthuswamy nadeem nagaraj nagesh nahla naila nalini nana naranbhai narayan naveen navin neeraj neha nehal nibaran nihal nihar niharika nikita nirav nitesh nitin nripendra oommen padmavati palanivel pallav pankaj parag parul parvati phani phanita poonam prajesh prakash pramod pranab pratibha pratul preeti priya priyanka puja radhanath ragini rahul raj raja rajan rajendra rajesh rajinder rajiv rakesh ram ramakant ramesh ramya rana ranbir randhir ranganath rani rashmi rati ravinder ravish reena rekha richa rinjish ritwik ritwika rohit sachin sahil saket saloni samar samir sanah sandhya sandipan sania sanjib sarabjit saravanan satyajit satyana savitri sekar shahbaz shahnaz shailendra sharad sharada sharmila sheela sheetal shekhar shilpa shishir shishira shreya shridhar shubhendu shweta sitaramayya smeet sneha somesh soumitra sourav srikanta srinivas subrata sudha sudhir sujata sukhbir sulochana sundar sunil supriya surendranath suresh sureza surinder sushma susmita swetha tala tanisha tanushree tanvi tarun tejal tina uma umesh upendra vaibhav varsha vasudevan venkataraman venu vibha vijayalakshmi vikas vinay vinod vivek vrushali wasim yamini yash yugesh
irishForenames,abbán affraic agaistín aibhilín aibhne aifric ailbhe ailin ailín aindriú aindréas ainm ainníleas aislin aisling aislinn aithche ambrós amhalgaidh amhlaoibh anluan anmchadh anne antóin aodh aodhagán aodhamair aodhnait aodhán aogán aoibhe aoibheann aoibhin aoibhinn aoife aonghus ardghal ardghar art artúr athracht aíbhinn bairre baothghalach barra barrdhubh basil beacán bearach bearchán bearnárd beinidict blanche blinne bláth bláthnaid bran breandán breanndán breasal brian brighdín brighid brochadh bréanainn bríd brídín brónach buadhach buadhnait bébhinn cacht cailean cainneach cairbre caitlín caitrín caitríona calbhach canice caoilfhionn caoimhe caoimhghín caoimhín caolán caomhán carraig cathal cathaoir cathbharr catraoine ceallach ceallachán cearbhall charles charles charles ciamhnait cian ciannait cianán ciara ciarán cillian cinnéididh cinnéidigh cionaodh ciothruadh cliodhna clodagh clíona cobhfhlaith cobhlaith coilean coileán coilín coinneach coireall colla colm colmán colum comhghall comhghan comán conaire conall conchobhar conchubhar conchúr conghalach conmhac conn connla connlaodh conán cormac cosnamhach criomthann críostóir cróchán crónán cuan cuileán cuimín cyril cárthach cúchonnacht cúmhaighe cúmheadha dabhag dabhóg dainéal daire damhnait damháin daniel dara david deaglán dearbhfhorgaill dearbhfhorghaill dearbhla dearbháil deasmhumhnach declan deirdre denis dervilia dianaimh diarmaid diarmait doireann domhnall donn donnchadh donnchadha donnán dorothy dubhaltach dubhchobhlaigh dubhghall dubhghlas dubhán dubhóg dymphna dáithí déaglán dónall dúnlang eachaidh eachann eachdhonn eachthighearn eamon earcán earnait earnán easnadh edwina eibhlín eibhlín eignach eigneachán eilín eilís eimear eimer eimhear eireamhán eireamhón eirnín eithne eochaidh eoghainín eoghan eoin eóin fachtna faoiltighearna faolán fearadhach fearchar fearganainm fearghal fearghus feargus feary feichín feidhelm feidhlim felix fergus fiach fiacha fiachra fiadhnait finghin finian finnian fintan fionghuine fionn fionnbharr fionnghuala fionntán fionnuala fitheal flann flann flannait flannán flora fodhla forbhlaith froinsias fáilbhe féilim féthnaid féthnat fíneamhain fíona garbhán gearóid geiléis glaisne gobnait gormfhlaith gormlaith grace granya greagoir gráinne gréagóir honora iarfhlaith iarlaith iodhnait irial iósaf ióseph iúdás jeremiah john kyle labhrás lachtna lann laoighseach laoiseach lasairfhíona lasairian laurence lewis lewis liam lochlainn lochlann lomán lonán lorcán lubhrás lughaidh maeleachlainn maelsheachlainn maelíosa mainchín mairghréad mairéad maitiú malachy maodhóg maoilir maoilín maolcholm maolcholuim maolmhuire maolmórdha maolruadháin marion mathghamhain meabh meadhbh mealla meaveen meibhín meidhbhín miodhnait mortimer muadhnait muircheartach muireach muireadhach muireann muirgheal muirgheas muirinn muiris muirne murchadh máire máirtín máirín mícheál míde móirín mór naomhán naos neachtan neasán niall niallán niamh nioclás nuala nóirín nóra odharnait odhrán oilibhéar oireachtach oisín onóra oscar peadar peig peigi peigín pilib proinsias pádraig póil pól raghnailt raibhilín rathnait riain risteárd ristéard roger roibeard roibeárd roibhilín roibéard ros ruadhán ruaidhri ruairi ruairí ruari ruaridh ruarí ruibhilín ráichéal réamann réamonn ríoghnach ríona ríonach róis róisín rónán rós sadhbh saerbhreathach saev saoirse saorfhlaith saorla saorlaith sarah seachnasach seathan senán seoirse seosamh seán seárlas siadhal siaghal sinéad siobhán sioda sláine sorcha stíofán suibhne séadna séafra séamas séamus séan séaonin síle síomón síthmaith tadhg taichleach terry tiarnach tiarnán tiernan tighearnán tighernach timothy tiobóid toirdhealbhach toirleach tomás torna treabhair tuathal tuathflaith téodóir uaithne uaitéar ualgharg uallach uasal uilliam uinseann ultán vivian ágastas áilís áine árdghal árón éabha éadaoin éadbhárd éamon éanna éanán éibhear éignach éigneachán éimhear éimhín éinde éireamhón émer étaín íde órfhlaith órla órlaith úna
italianCities,acerra acireale afragola agrigento alessandria altamura ancona andria anzio aprilia arezzo asti avellino aversa bagheria bari barletta battipaglia benevento bergamo bisceglie bitonto bologna bolzano brescia brindisi cagliari caltanissetta campobasso carpi carrara caserta casoria catania catanzaro cerignola cesena chieti chioggia civitavecchia collegno como cosenza cremona crotone cuneo ercolano faenza fano ferrara fiumicino florence foggia foligno forli gallarate gela genoa giugliano grosseto imola laspezia latina lecce legnano livorno lucca manfredonia marsala massa matera messina milan modena modica molfetta moncalieri montecelio montesilvano monza naples novara olbia padua palermo parma pavia perugia pesaro pescara piacenza pisa pistoia pomezia pordenone portici potenza pozzuoli prato ragusa ravenna reggiocalabria reggioemilia rho rimini rome rovigo salerno sanremo sassari savona scafati scandicci siena syracuse taranto teramo terni tivoli trani trapani trento treviso trieste turin udine varese velletri venice verona viareggio vicenza vigevano viterbo vittoria
italianFoods,abbacchio acetodolce acquacotta acquapazza agliata agnolotti agrodolce anguillamarinata anisette arancini asiago asino babà baccalà baccalàfritto bagnacàuda bari bavette belpaese biscotti biscuittortoni bisteccafiorentina bitto boreto bozzapratese bra braciole braciolone breadsticks bresaola brodo bruschetta buccellato buridda burrata burrini butirro cacciatore cacciucco caciocavallo cacioricotta calamarettifritti calamariripieni calzone canestratopugliese cannelloni cannolo capellini capesante capocollo caponata capponmagro caprino carbonara carnepizzaiola carrozza casatiello casiello cassatasiciliana castelmagno casumodde casècc cevapcici chiacchiere chitarra ciabatta ciabusco ciaccino ciarduna ciccillo ciriola conchiglie coppiaferrarese crauti crescentina crescenza crocchè crocetta crostata crostini crostoli crostui crotonese culatello culatello ditalini eliche farfalle farinata ficattola fioresardo focaccia focacciaalrosmarino fonduta fontina fragguno frutti fruttidibosco garganelli garmugia gelato ginestrata giuncata gnocchi gorgonzola goulash granapadano grancevola granita guanciale gubana insalatacaprese insalatadiriso lasagna latteria liptauer lonza maccheroni maccu malga marzolino marzotica mascarpone michetta minestrone moddizzosu montasio mortadella mozzarella muffuletta murazzano murenafritta neccio nervetti oca offelle olives orataarrosto oratealforno orzo ossobuco ossobuco pancetta pandoro panettone panforte panino pannacotta panzanella parmigianoreggiano pastaalpesto pastaefagioli pastiera pecorinoromano pecorinosardo penia peperonata peperoniimbottiti pesto pestât piacentinu piadina piccolifrutti pignolata pinzimonio pita pizza pizzacapricciosa pizzamarinara pizzapugliese pizzaromana pizzasiciliana pizzelle porcaloca presnitz primosale profiterole prosciutto provolone quartirolo ragusano ragù raschera ravioli ricotta ricottasalata risotto robiola rosetta salame salami salsiccia scampi scampigratinati schiacciata sciusceddu semifreddo slattato spaghetti spezzatino spiedini spinasanta squacquerone stelline stigghiola stoccafisso stracchino stracciatella strolghino strucchi strucoli struffoli tabor tacconi taleggio taralli testaroli testarolo tigella tiramisù toma tortacaprese tortano tortellini vermicelli zabaglione ziti bigoli bucatini cappelletti crespelle festoni fettuccine filatieddi fusilli gulash lasagnette linguine lumache malloreddus maltagliati marille marrubini rigatoni tagliarini tagliatelle tonnarelli tortellini trenette trofie trottole
italianForenames,achille adamo adelasia adele adelmo adriana adriano agatha agnolo agostino alberico alberto albina aldo alessandra alessandro alessia alfredo alina alphons amadeo amanda amedeo amita andrea angelica angelina angelo anita annalisa annetta antonietta antonio arlo armando arsenio arturo aurora baldassare barbara bartolomeo beatrice benedetto benito benvenuto beppe berenice bernardo bettina bianca biancamaria bruno camilla camillo carmelo carmine carolina cassandra caterina cecilia cesare chiara claudia claudio clelia constantino corrado cosimo costanzo cristina damiano daniele danilo dante daria dario davide delfino diana dina dino domenico donatella durante edoardo elena eliana elisa elmo elvira emiliana emilio emma ennio enrico enzo eraldo erika ermenegildo ernesto ettore eugenia eva fabia fabio fabrizio fausto federico federigo ferdinando fernanda fiamma filippa filippo fiorino flavia flavio flora francesca francesco fredo fulvio gabriele gabriella gaetano gaspare gastone gemma geppetto giacinto giacobbe giacomo giada giampaolo giampiero gian giancarlo gianfrancesco gianfranco gianluca gianluigi gianmarco gianna gianni gianpaolo gianpietro gilberto gino giorgia giorgio giovanna giovanni girolamo giulia giuliana giuliano giulietta giulio giuseppe giuseppina graziano griselda guarino guglielmo guido gustavo imelda ingrid irma isa isabella ivo jacopo joseph julia lamberto lando lara laureano lauretta leonardo leone liberto licia lilla lina livia livio lorenzo luca luchino lucia luciana luciano lucio lucrezia ludovica ludovico luigi luisa manuel marcella marcello marco maria mariano mariella mario marisa marissa martina martino massimiliano massimo matilda matteo maura maurilio maurizio mauro melania melina melissa michela michelangelo michele micheletto michelotto milena milo mirco mirko morena nadia napoleone natalia neri niccolò nicholas nicola nicole nicoletta nicolò nina nino nunzio omero onofrio orazio oreste orlando ornella osvaldo ottavio paloma panfilo paola paolo pascale pasqual pasquale paulina pellegrino pierangelo piergiorgio piergiuseppe pierluigi piermaria piersanti pietro pompeo priscilla puccio rachel raffaella raffaello renata renato renzo riccardo rita roberto rodolfo rolando romana romina romolo rosa rosalia rosaria rosario rosina ruggero ruggiero sabatino salvatore salvi sandra sandro sante santino saverio sebastian serafina serena severino silvestro silvia silvio sonia sophia stefania stefano stella susanna tatiana tazio temistocle tiziano toni torquato tullio ubaldo ugo umberto valentina valeria valerio vanessa vanna veronica vincentio vincenzo virginia viridiana vito vittoria vittoria vittorio zaira zanobi
japaneseCities,abashiri abiko adachi agano ageo aioi aira aisai aizuwakamatsu akabira akaiwa akashi aki akiruno akishima akita akitakata akune akō ama amagasaki amakusa amami anan anjō annaka aomori arakawa arao arida asago asahi asahikawa asaka asakuchi asakura ashibetsu ashikaga ashiya aso atami atsugi awa awaji awara ayabe ayase azumino bandō beppu bibai bizen bungotakada bunkyo buzen chiba chichibu chigasaki chikugo chikuma chikusei chikushino chino chiryū chita chitose chiyoda chōfu chōshi chūō chūō daisen daitō date date dazaifu ebetsu ebina ebino echizen edogawa ena eniwa etajima fuchū fuchū fuefuki fuji fujieda fujiidera fujimi fujimino fujinomiya fujioka fujisawa fujiyoshida fukagawa fukaya fukuchiyama fukui fukuoka fukuroi fukushima fukutsu fukuyama funabashi furano fussa futtsu gamagōri gero gifu ginowan gobō gojō gose gosen goshogawara gotenba gotō gujō gyōda gōtsu habikino hachimantai hachinohe hachiōji hadano hagi hakodate hakui hakusan hamada hamamatsu hamura hanamaki handa hannan hannō hanyū hashima hashimoto hasuda hatsukaichi hekinan hida hidaka higashihiroshima higashikagawa higashikurume higashimatsushima higashimatsuyama higashimurayama higashine higashiyamato higashiōmi higashiōsaka hikari hikone himeji himi hino hioki hirado hirakata hirakawa hiratsuka hirosaki hiroshima hita hitachi hitachinaka hitachiōmiya hitachiōta hitoyoshi hokota hokuto hokuto honjō hyūga hōfu ibara ibaraki ibusuki ichihara ichikawa ichikikushikino ichinomiya ichinoseki iga iida iiyama iizuka ikeda iki ikoma imabari imari imizu ina inabe inagi inashiki inazawa inuyama inzai iruma isa isahaya ise isehara isesaki ishigaki ishikari ishinomaki ishioka isumi itabashi itako itami itoigawa itoman itoshima itō iwade iwaki iwakuni iwakura iwamizawa iwanuma iwata iyo izu izumi izumi izumisano izumiōtsu izumo izunokuni jōetsu jōsō jōyō kadoma kaga kagoshima kahoku kai kainan kaizu kaizuka kakamigahara kakegawa kakogawa kakuda kama kamagaya kamaishi kamakura kameoka kameyama kami kaminoyama kamisu kamo kamogawa kan'onji kanazawa kani kanoya kanuma kanzaki karatsu kariya kasai kasama kasaoka kashiba kashihara kashima kashima kashiwa kashiwara kashiwazaki kasuga kasugai kasukabe kasumigaura katagami katano katori katsuragi katsushika katsuura katsuyama katō kawachinagano kawagoe kawaguchi kawanishi kawasaki kazo kazuno kesennuma kikuchi kikugawa kimitsu kinokawa kirishima kiryū kisarazu kishiwada kita kitaakita kitahiroshima kitaibaraki kitakami kitakata kitakyūshū kitami kitamoto kitanagoya kitsuki kiyose kiyosu kizugawa kobayashi kobe kodaira koga koga koganei kokubunji komae komagane komaki komatsu komatsushima komoro konan kosai koshigaya koto kudamatsu kuji kuki kumagaya kumamoto kumano kunisaki kunitachi kurashiki kurayoshi kure kurihara kurobe kuroishi kurume kusatsu kushima kushiro kuwana kyoto kyōtanabe kyōtango kōchi kōfu kōka kōnan kōnan kōnosu kōriyama kōshi kōshū machida maebashi maibara maizuru makinohara makurazaki maniwa marugame masuda matsubara matsudo matsue matsumoto matsusaka matsuura matsuyama meguro midori mihara mikasa miki mima mimasaka minamata minamiashigara minamiawaji minamibōsō minamikyūshū minamisatsuma minamishimabara minamisōma minato mine mino minoh minokamo misato misawa mishima mitaka mito mitoyo mitsuke miura miyako miyakojima miyakonojō miyama miyawaka miyazaki miyazu miyoshi miyoshi miyoshi mizuho mizunami mobara monbetsu mooka moriguchi morioka moriya moriyama motomiya motosu mukō munakata murakami murayama muroran muroto musashimurayama musashino mutsu myōkō nabari nagahama nagai nagano nagaoka nagaokakyō nagareyama nagasaki nagato nago nagoya naha naka nakama nakano nakatsu nakatsugawa namegata namerikawa nan'yō nanao nanjō nankoku nantan nanto nara narashino narita naruto nasukarasuyama nasushiobara natori nayoro nemuro nerima neyagawa nichinan nihonmatsu niigata niihama niimi niiza nikaho nikkō ninohe nirasaki nishinomiya nishinoomote nishio nishitōkyō nishiwaki nisshin nobeoka noboribetsu noda nomi nonoichi noshiro numata numazu nōgata obama obanazawa obihiro odawara oga ogi ogōri ojiya okaya okayama okazaki okegawa okinawa omaezaki omitama ono onomichi osaka otaru owariasahi owase oyabe oyama rikuzentakata rittō rumoi ryūgasaki sabae sado saga sagae sagamihara saijō saikai saiki saitama saito sakado sakai sakai sakaide sakaiminato sakata saku sakura sakura sakuragawa sakurai sanda sanjō sanmu sano sanuki sapporo sasayama sasebo satsumasendai satte sayama seiyo seki semboku sendai sennan setagaya seto setouchi settsu shibata shibetsu shibukawa shibushi shibuya shijōnawate shiki shikokuchūō shima shimabara shimada shimanto shimoda shimonoseki shimotsuke shimotsuma shinagawa shingū shinjuku shinjō shinshiro shiogama shiojiri shirakawa shiroi shiroishi shisō shizuoka shōbara shūnan sodegaura soo special suginami suita sukagawa sukumo sumida sumoto sunagawa susaki susono suwa suzaka suzu suzuka sōja sōka sōma sōsa tachikawa tagajō tagawa tahara tainai taitō tajimi takahagi takahama takahashi takaishi takamatsu takaoka takarazuka takasago takasaki takashima takatsuki takayama takehara takeo taketa takikawa takizawa taku tama tamana tamano tamba tamura tanabe tarumizu tatebayashi tateyama tatsuno tendō tenri toba tochigi toda toki tokoname tokorozawa tokushima tomakomai tome tomigusuku tomioka tomisato tonami tondabayashi toride tosa tosashimizu toshima tosu tottori towada toyama toyoake toyohashi toyokawa toyonaka toyooka toyota tsu tsubame tsuchiura tsugaru tsukuba tsukubamirai tsukumi tsuru tsuruga tsurugashima tsuruoka tsushima tsushima tsuyama tōgane tōkai tōkamachi tōmi tōno tōon ube uda ueda uenohara uji uki ukiha unnan unzen uonuma uozu urasoe urayasu ureshino uruma usa ushiku usuki utashinai uto utsunomiya uwajima wajima wakayama wakkanai wakō warabi yabu yachimata yachiyo yaita yaizu yamaga yamagata yamagata yamaguchi yamanashi yamato yamatokōriyama yamatotakada yame yanagawa yanai yao yashio yasu yasugi yatomi yatsushiro yawata yawatahama yokkaichi yokohama yokosuka yokote yonago yonezawa yoshikawa yoshinogawa yotsukaidō yufu yukuhashi yurihonjō yuzawa yūbari yūki zama zentsūji zushi ōbu ōda ōdate ōfunato ōgaki ōita ōkawa ōmachi ōme ōmihachiman ōmura ōmuta ōno ōnojō ōsakasayama ōsaki ōshū ōta ōta ōtake ōtawara ōtsu ōtsuki ōzu
