nameType,examples
norwegianFjords,adventfjorden arasvikfjord astafjorden austefjorden austfjorden balsfjorden batnfjord beitstadfjorden billefjorden bindalsfjorden bjugnfjorden bjørnafjorden boknafjord breviksfjord bunnefjorden byfjorden bøkfjord bømlafjorden dalsfjorden dicksonfjorden drammensfjord duvefjorden edøyfjorden eidangerfjord eidsfjorden ekmanfjorden eresfjorden erfjorden esefjorden etnefjorden fanafjorden fannefjord finnøyfjord fisterfjord fognafjord folda forfjord fossingfjord freifjorden frierfjord frænfjorden frøyfjorden fusafjorden fættenfjord førdefjorden gandsfjord gapafjord gardssundfjord geirangerfjord gratangen grimstadfjord grindafjord grønfjorden gullesfjorden gunneklevfjord hadselfjord halsafjord hamnesfjord hardangerfjord hellemofjorden hemnfjorden herdlefjord herjangsfjord hervikfjord herøyfjord hidlefjord hjeltefjorden hjørundfjorden hornsund hyllestadfjorden hylsfjord håsteinsfjord høgsfjorden høyangsfjorden iddefjord idsefjord indre oslofjord innværfjorden isfjorden jarfjorden jelsafjord jøsenfjorden jøssingfjorden kaldfjord kaldvågfjorden kilsfjord kobbefjorden kongsfjorden kornstadfjord krossfjorden kurefjorden kvernesfjord kvitsøyfjord kvåsefjorden kvænangen kåfjorden laksefjord langangsfjord langfjorden lavangen leirfjorden liefdefjorden lille kufjorden listafjord lomfjorden lustrafjorden lyngenfjorden lysakerfjorden lysefjorden magdalenefjorden malangen maurangerfjord mefjorden melfjorden meløyfjorden midtgulen moldefjord namsfjorden norddalsfjorden nordefjorden nordfjorden nordgulfjorden nærøyfjord ofotfjord ombofjord orkdalsfjorden ormefjord osafjord oslofjord osterfjorden porsangerfjorden puddefjorden ranfjorden raudfjorden recherchefjorden revsbotn rijpfjorden rombaken romsdalsfjord rovdefjord sagfjorden salhusfjorden sandefjordsfjord sandeidsfjord sandsfjord sassenfjorden saudafjord selbjørnsfjorden sjona skjerstadfjorden skjoldafjord skjomen skudenesfjord skånevikfjorden snigsfjorden snillfjorden sognefjord solbergfjord stavfjord stjørnfjord storfjorden sulafjorden sunndalsfjord sunnylvsfjorden sykkylvsfjorden syvdsfjorden sørfjorden sørgul tafjorden talgjefjord tanafjord tempelfjorden tingvollfjorden tjongsfjorden tjuvfjorden tomrefjorden topdalsfjorden tresfjorden trollfjord trondheimsfjord trongfjord trænfjorden tysfjorden tyssefjord ullsfjord valsøyfjorden van keulenfjorden van mijenfjorden vanylvsfjorden varangerfjord vartdalsfjord vatsfjord vefsnfjorden vegafjorden velfjorden vestfjorden vestfjorden vetlefjorden vindafjorden vinjefjorden voldsfjorden værangfjorden wahlenbergfjorden wijdefjorden woodfjorden yrkefjorden ytre oslofjord åfjorden åkrafjorden åmøyfjord årdalsfjord øksfjord økstrafjorden
nutsAndSeeds,acorn almond apricot barley beech blackeyedpea blackwalnut bopplenut brazilnut breadnut broadbean buckwheat bunyanut candlenut cashew cashewnut cattail cempedak chestnuts chia chickpea chileanhazelnut chinesechestnut cocoabean coconuts coffeebean colocynth commonbean cowpeas drybeans durian favabean flax fonio foxnut gabonnut grainamaranth groundnut groundnut hanza hazelnut heartnuts hemp hickory hyacinthbean indianbeech jackfruit jacknuts japanesechestnut kolanut lotusseed lupin macadamia maize malabaralmond malabarchestnut malabargourd mamoncillo melonseed mongongo monkeypuzzlenut moringa oats ogbono palmersgrass palmnut paradisenut pea peanut pearlmillet pecan pepita pigeonpea pili pilinuts pinenuts pistachio pitseed poppyseed quinoa rice rye sesame shagbark sorghum soybean spelt sunflowerseed sweetchestnut teff triticale velvetbean walnut waterchestnut wheat wild rice wingedbean yambeans yellowwalnut
periodicElements,actinium aluminum americium antimony argon arsenic astatine barium berkelium beryllium bismuth bohrium boron bromine cadmium calcium californium carbon cerium cesium chlorine chromium cobalt copper curium dubnium dysprosium einsteinium erbium europium fermium fluorine francium gadolinium gallium germanium gold hafnium hassium helium holmium hydrogen indium iodine iridium iron krypton lanthanum lawrencium lead lithium lutetium magnesium manganese meitnerium mendelevium mercury molybdenum neodymium neon neptunium nickel niobium nitrogen nobelium osmium oxygen palladium phosphorus platinum plutonium polonium potassium praseodymium promethium protactinium radium radon rhenium rhodium rubidium ruthenium rutherfordium samarium scandium seaborgium selenium silicon silver sodium strontium sulfur tantalum technetium tellurium terbium thallium thorium thulium tin titanium tungsten uranium vanadium xenon ytterbium yttrium zinc zirconium
personalityTraits,abrasive abrupt absentminded adaptable admirable adventurous aggressive agonizing agreeable aimless airy alert aloof ambitious amiable amoral amusing angry anticipative anxious apathetic appreciative argumentative arrogant artful articulate artificial ascetic asocial aspiring assertive astigmatic athletic attractive authoritarian barbaric benevolent bewildered bizarre bland blunt boyish breezy brilliant brittle brutal busy calculating callous calm capable captivating careless caring casual cautious challenging charismatic charming charmless cheerful childish chummy circumspect clean clearheaded clever clumsy coarse cold colorful colorless compassionate competitive complacent complex compulsive conceited conciliatory confident confidential confused conscientious conservative considerate contemplative contemptible contradictory conventional cooperative courageous courteous cowardly crass crazy creative criminal crisp crude cruel cultured curious cute cynical daring decadent deceitful decent deceptive decisive dedicated deep demanding dependent desperate destructive determined devious difficult dignified dirty disciplined disconcerting discontented discouraging discourteous discreet dishonest disloyal disobedient disorderly disorganized disputatious disrespectful disruptive dissolute dissonant distractible disturbing dogmatic dominating domineering dramatic dreamy driving droll dry dull dutiful dynamic earnest educated effeminate efficient egocentric elegant eloquent emotional empathetic energetic enervated enigmatic enthusiastic envious erratic escapist excitable exciting expedient extraordinary extravagant extreme fair faithful faithless fanatical fanciful farsighted fatalistic fawning fearful fickle fiery firm flamboyant flexible focused folksy foolish forgetful forgiving formal forthright fraudulent freethinking freewheeling friendly frightening frivolous frugal gallant generous gentle genuine glamorous gloomy goodnatured gracious greedy grim guileless gullible hardworking hateful haughty healthy hearty hedonistic helpful herioc highhanded highminded highspirited honest honorable hostile humble humorous huried hypnotic iconoclastic idealistic idiosyncratic ignorant imaginative impassive impatient impersonal impractical impressionable impressive imprudent impulsive incisive inconsiderate incorruptible incurious indecisive independent individualistic indulgent inert inhibited innovative inoffensive insecure insensitive insightful insincere insulting intelligent intense intolerant intuitive invisible invulnerable irrational irresponsible irritable kind knowledge lazy leisurely liberal logical loquacious lovable loyal lyrical magnanimous malicious manysided masculine maternal maticulous mature meddlesome melancholic mellow meretricious methodical miserable miserly misguided mistaken moderate modern modest moneyminded monstrous moody moralistic morbid mystical naive narcissistic narrow narrowminded neat neglectful neurotic neutral nihilistic noncommittal obedient objective obnoxious observant obsessive obvious offhand open opinionated opportunistic optimistic orderly ordinary organized original outrageous outspoken painstaking paranoid passionate passive paternalistic patient patriotic peaceful pedantic perceptive perfectionist personable persuasive perverse petty pharissical phlegmatic physical placid planful playful plodding polished political pompous popular possessive practical precise predatory predictable prejudiced preoccupied presumptuous pretentious principled private procrastinating profligate profound progressive protective proud provocative prudent pruposeful pugnacious punctual pure puritanical questioning quiet rational reactionary reactive realistic reflective regretful relaxed reliable religious repentant repressed resentful reserved resourceful respectful responsible responsive restrained retiring ridiculous rigid ritualistic romantic ruined sadistic sage sanctimonious sane sarcastic scheming scholarly scornful scrupulous secretive secure sedentary selfconscious selfindulgent selfish selfless selfreliant selfsufficent sensitive sensual sentimental serious sexy shallow shortsighted shrewd shy silly simple singleminded skeptical skillful slow sly smooth sober sociable soft softheaded solemn solid solitary sophisticated sordid spontaneous sporting stable steadfast steady steely stern stiff stoic strict strong stubborn studious stupid stylish suave submissive subtle superficial superstitious suspicious sweet sympathetic systematic tactless tasteful tasteless tense thievish thorough thoughtless tidy timid tolerant tractable transparent treacherous trendy troublesome trusting unaggressive unambitious unappreciative uncaring unceremonious uncharitable uncooperative unctuous undemanding understanding undisciplined undogmatic unfathomable unfriendly ungrateful unhealthy unimaginative unimpressive uninhibited unlovable unpatriotic unpolished unpredicatable unprincipled unrealistic unreflective unreliable unreligious unrestrained unsentimental unstable upright urbane vacuous vague venal venomous venturesome vindictive vivacious warm whimsical winning wise witty youthful
philosophies,ableism absolutism absurdism acquiescence activism actualidealism actualism aestheticrealism aesthetics agentialrealism agnosticism agnotology altruism amorfati analytic philosophy anarchism ancientphilosophy animism anomalous monism anthropocentrism antiimperialism antiintellectualism antinatalism antipsychiatry antirealism antireductionism applied ethics aristotelianism asceticism atavism atheism authoritarianism autodidacticism averroism avicennism axiology baathism baháíteachings behaviorism biblicalliteralism bioconservatism bioethics biolibertarianism biosophy bushido capitalism cartesianism catechism centrism chaostheory charvaka chauvinism chinesenaturalism christianecology christianexistentialism christianhumanism christianphilosophy christiantheology christology classicalliberalism cognitivism collectivism communitarianism compatibilism computerethics conformism confucianism consequentialism conservatism constructivistepistemology continentalphilosophy continuationism cosmopolitanism creationism criticalrationalism criticalrealism cultural elativism cynicism daoism darwinism deconstruction defeatism deism democratictranshumanism denialism deontology determinism dialectic dialecticalmaterialism didacticism digitalphilosophy discordianism dogma dualism dvaita ecumenism egalitarianism egocentrism eliminativematerialism empiricism environmentalism epicureanism epiphenomenalism epistemology erudition eschatology esotericism ethicalegoism ethics eudaimonism eugenics evangelism existentialism externalism externalism extremism fallacy fanaticism fascism feminism fengshui filialpiety flowersermon foundationalism freemasonry freewill fundamentalism germanidealism germanphilosophy globalism gnosticism gothicismus greekphilosophy hasidism hedonism hegelianism hegeliansynthesis hermeneutics hermeticism heterophenomenology historicism holism hongaku humanexceptionalism humanism humanisticnaturalism idealism identityism ignosticism illegalism illuminationism incontinence individualism inductionism informal logic innatism instrumentalism instrumentalrationality internalism interventionism intuitionism irrealism jainism jesuism juche judaism kaizen kantianism legalism leibnizianism libertarianism literarycriticism literarytheory logicians logicism lutheranism machiavellianism manichaeism maoism marxism materialism mathematicism mazdakism medievalism mentalism mereologicalnihilism metaethics metaphilosophy metaphysics methodism misanthropy misology modernism monism monogamy monotheism moralrealism moralrelativism moralskepticism multilateralism mysticism natalism naturalism naïverealism negationism neoconfucianism neohegelianism neokantianism neoplatonism neopythagoreanism neoscholasticism neotaoism neuroethics neurophilosophy neurotheology neutralmonism newage newrealism newthought nihilism nominalism nondualism objectiveidealism objectivism occamsrazor occasionalism ontology ontotheology openindividualism opportunism optimism organicism orientalism pacifism paganism pain pancriticalrationalism pandeism panentheism panpsychism pantheism paradigm pataphysics patriotism perfectionism peripatetic personalism perspectivism pessimism phenomenalism phenomenology physicalism physicalontology platonicrealism platonism pluralism polygamy populism positivism posthumanism postmaterialism postmodernism poststructuralism pragmatism premillennialism presentism progressivism property dualism proselytism pseudophilosophy psychologicalegoism pythagoreanism quantummysticism quietism racism rastafari rationalism raëlism realism reconstructivism reductionism reductivematerialism reformationalphilosophy reification relationalism relativism reliabilism romanticism sabellianism scandal scholasticism scientism secretsociety secularhumanism secularism semanticholism sensualism sexism sexualism shamanism sikhism simulism singularitarianism skepticism socialbusiness socialphilosophy solipsism sophism spiritualism stoicism structuralism subjectiveidealism subjectivism sufimetaphysics supersessionism supervenience surrealism survivalism synopticphilosophy taoism tautology teleology tetralemma theism thelema theology theosophy transcendentalidealism transcendentalism transhumanism transmodernism unilateralism universalism utilitarianism utopianism valuetheory verificationism virtueethics vitalism voluntaryism westernphilosophy wiccan zen zoroastrianism zurvanism śūnyatā
pies,aloopie applecrisp applecrumble applepie baconeggpie bakewelltart bananacreampie banoffeepie beanpie bisteeya blackberrypie blackbottompie blackbun blueberrypie bobandypie bougatsa boysenberry bridie bukopie bumbleberrypie bundevara burek buttermilkpie butterpie buttertart cantaloupepie carameltart cashewpie cheesecake cheesepie cherrypie chesspie chestnutpie chickenmushroompie chiffonpie cipaille clanger coconutcreampie cookiecakepie cornedbeefpie cottagepie coulibiac cumberlandpie currypie currypuff custardtart derbypie echpochmak eggtart empanada fishermanspie fishpie flan flapperpie fleischkuekle flipperpie friedpie gibanica greekcheesepie greengrapepie homitypie hornazo jamaicanpatty kalakukko karelianpasties keylimepie khachapuri killiepie knish kuchen lemoniceboxpie lemonmeringuepie manchestertart meatpie meatpie meatpotatopie meltonowbrayporkpie mincepie mississippimudpie natchitochesmeatpie nusstorte pastafrola pasty peachpie peanutpie peartart pecanpie pirozhki porkpie potpie pumpkinpie quiche raisinpie rappiepie raspberrypie razzleberrypie rhubarbpie sambusac saskatoonberrypie scotchpie seapie sfiha shakerlemonpie shepherdspie shepherdspie shooflypie soparnik southerntomatopie spanakopita stargazypie steakkidneypie steakpie strawberrypie strawberryrhubarbpie sugarpie sweetpotatopie tiropita treacletart vlaai walnutpie watalappam wooltonpie spinachpie
placesInCumbria,abbeytown ackenthwaite adgarley aglionby aiketgate aikhead aikshaw aikton ainstable aisgill albyfield aldingham aldoth allenwood allerdale allerdale allhallows allithwaite allonby alston alstonmoor ambleside angerton annaside anthorn appleby applethwaite arkleby arlecdon armaside armathwaite arnaby arnside arradfoot arthuret asby ashgill askerton askham aspatria aughertree ayside backbarrow baggrow baldwinholme bampton bamptongrange bandrakehead banks barbergreen barbon barclose bardsea barepot barras barrow barrowisland barrowsgreen barton bassenthwaite baycliff bayles beanthwaite beaumont beckbottom beckces beckermet beckfoot beckhead beckside beetham belah bellevue berrier bewaldeth bewcastle biggar biglands birkby birkerthwaite blackbeck blackcombe blackdyke blackford blackpoolgate blackwell blagill blawith bleatarn blencarn blencogo blencow blindbothel blindcrake blitterlees bolton boltongate boltonlowhouses boltonnewhouses boltons boltonwoodlane bomby bonninggate boot bootle borrowdale botcherby bothel bousteadhill bouth bowlandbridge bowmanstead bowscale bowston brackenber brackenlands brackenthwaite braithwaite brampton brandlingill bransty branthwaite brathay braystones braytonpark bretherdalehead bridekirk bridgefield bridgefoot briery brigham brigsteer brisco briscoe broadoak broadwath brockleymoor bromfield broom brothybeck brough brougham broughsowerby broughton broughtonbeck broughtoncross broughtoneast broughtonmills broughtonmoor broughtonwest brownber browtop brunstock brunthwaite buckabank bullgill burghbysands burneside burnrigg burrells burtholme burthwaite busk buttermere butterwick caldbeck calder calderbridge calthwaite calva cambeckbridge camerton canalfoot cardew cardewlees cardurnock cargo cark carlatton carlisle carrbank cartmel cartmelfell carwinley casterton castlecarrock castlesowerby castletown catbank catlowdy catterlen causewayend causewayhead cautley chalkfoot chapel chapelstile chestnuthill churchbrough claife clappersgate clawthorpe cleabarrow cleator cleatormoor cliburn clifton cliftondykes cockermouth cocklake cockleybeck colby coldbeck colthouse colton commonend coniston corbyhill corkickle corney cotehill cotes coulderton coupland cowenhead cowgill crackenthorpe croasdale crofton croglin crook crooklands crosby crosbygarrett crosbyravensworth crosbyvilla croslandspark crosscanonby crossend crossgates crosslands crosthwaite culgaith cumbria cumdivock cummersdale cumrew cumwhinton cumwhitton currock dacre dale dalebottom dalemain dalston dalton dean deanscales dearham deepthwaite dendron dent dentonholme distington dockray dovenby downhall dragleybeck drigg drumburgh drumleaning drybeck dubwath duddonbridge dufton dundraw dungeonghyll durdar dykesfield eaglesfield eamontbridge eastcurthwaite edderside edenhall edentown egremont egtonwithnewland ellenborough ellonby elterwater embleton endmoor ennerdalebridge eskdale eskdalegreen eskett etterby ewanrigg fairhill fararnside farend farlam farleton farsawrey faugh fawcettforest fellside fenton fieldbroughton fingland finsthwaite firbank fletchertown flimby flitholme flookburgh floristonrigg forceforge foresthead fornside fothergill foulbridge foxfield frizington gaisgill galligill gamblesby gamelsby garlands garnettbridge garrigill garsdale garsdalehead garthrow garths gatebeck gatefoot gatesgarth gawthrop gawthwaite geltsdale gilcrux gilsland glasson glasson glassonby gleaston glencoyne glenridding goadsbarrow goodyhills goosegreen gosforth grangefell grasmere grassgarth grayrigg graysongreen greatasby greatblencow greatbroughton greatclifton greatcorby greatcrosthwaite greatlangdale greatmusgrave greatormside greatorton greatsalkeld greatstrickland greaturswick greenbank greengill greenhead greenhill greenholme greenodd greenquarter greenrow greenwell greysouthen greystoke greystone grinsdale grisedale grizebeck grizedale gullomholme hackthorpe haile hailforth hale halfpenny hallbankgate hallbeck halldunnerdale hallowbank hallsanton hallthwaites hallwaberthwaite haltcliff hampsfield hardendale haresceugh harker harkermarsh harraby harrington harriston hartley hartsop hassness haverigg haverthwaite hawcoat hawksdale hawkshead hawksheadhill hawsbank hayton hayton hazelrigg hazelslack headsnook heaning heathwaite hegglelane helbeck helsington helton helvellyn hensingham hesket hethersgill highbankhill highbewaldeth highbiggins highbridge highcasterton highcrosby highcunsey highgreen highhesket highhill highireby highknipe highlaws highlorton highmoor highnewton highoaks highrigg highrow highscales highside highwray hilltop hilton hincaster hodbarrow holker hollins holme holmeabbey holmelow holmrook holmwrangle honisterpass hopebeck hornsby houghton how howgate howgill hugill hunsonby hurst hutton huttonend huttonsoil hycemoor hyton ireleth irthington isel ivegill jericho johnby kaber keekle keisley kelbarrow keld kelleth kells kelsick kendal kentmere kentrigg kentsbank keswick killington kilnhill kingmoor kingsmeaburn kingstown kingwater kinkryhill kirkbampton kirkhouse kirklandguards kirklinton kirklintonmiddle kirkoswald kirksanton lakeside lambfoot langdale langwathby leadgate leasgill legburthwaite lessonhall levens littlebeck littlebroughton littleclifton littlelangdale littletown lockhills longburgh longlands longmarton longpark longthwaite loweswater lowick lowther martindale mawbray mealbank mealsgate melmerby micklethwaite middleton midgeholme milburn millom milnthorpe milton mockerkin monkhill moorrow moresby morland morton mosedale muncaster mungrisdale murton nateby natland nearsawrey nenthall nenthead nethertown netherwasdale newcowper newhutton newland newlands newton newtonarlosh newtonreigny newtonrigg newtown northdykes northscale oddendale oldhutton ormside orthwaite orton oughterside oulton ousby outhgill oxenholme oxenpark papcastle parsonby parton patterdale pennington penrith penruddock petterilgreen pielisland plumbland plumpton ponsonby pooleybridge rampside raughtonhead ravenglass ravenstonedale renwick rickerby roanhead rockcliffe roose roosebeck rosside rosthwaite roundthwaite ruckcroft ruleholme rusland rydal sadgill santonbridge satterthwaite scaleby scalebyhill scotby seascale seathwaite seatoller seaton sedbergh sedgwick selside shap shoregill siddick silecroft silloth silverband skelton skelwithbridge skinburness skirwith skitby slackhead smithfield sockbridge southwaite sparkbridge stair stanah stapleton staveley stbees stockdalewath stonehouse sunderland swarthmoor swindale tarns templesowerby thiefside thornhill thornthwaite threapland threlkeld thursby thwaites tirril todhills torpenhow torver troutbeck troutbeckbridge uldale ulpha ulverston underbarrow underskiddaw upperdenton upton vickerstown waberthwaite walton warcop warwickbridge wasdale wasdalehead watchgate watendlath watermillock waverton westnewton westward wetheral wetsleddale whale whicham whitehaven wiggonby wigton wilton windermere winscales winton witherslack wolsty woodend woodend woodland workington wreay wythburn wythopmill yanwath yarlside yearngill yottenfews
